{
  "$schema": "../_schema.json",
  "id": "mailbox-operations",
  "title": "Mailbox Operations (Exchange Online)",
  "order": 4,
  "status": "complete",
  "summary": "Reference implementation. Covers the three questions a BEC or mailbox-compromise investigation has to answer: what did they read, what did they leave behind to keep reading it, and who else did they give access to.",
  "workloads": [
    "Exchange"
  ],
  "recordTypes": [
    {
      "id": 1,
      "member": "ExchangeAdmin",
      "role": "Cmdlet-driven changes: inbox rules created outside the Outlook client, permission grants, forwarding, audit bypass."
    },
    {
      "id": 2,
      "member": "ExchangeItem",
      "role": "Single-item and client-side actions, including UpdateInboxRules and FolderBind."
    },
    {
      "id": 3,
      "member": "ExchangeItemGroup",
      "role": "Bulk item actions such as multi-item move or delete."
    },
    {
      "id": 50,
      "member": "ExchangeItemAggregated",
      "role": "MailItemsAccessed. The primary evidence for scoping what an attacker read."
    },
    {
      "id": 19,
      "member": "ExchangeAggregatedOperation",
      "role": "Aggregated Exchange activity; useful for volume baselining."
    },
    {
      "id": 101,
      "member": "ExchangeSearch",
      "role": "OWA search terms. Reveals what the attacker was hunting for. Audit (Premium) and not enabled by default."
    }
  ],
  "scenarios": [
    {
      "id": "mailitemsaccessed-scoping",
      "title": "Scoping mailbox data access after compromise",
      "summary": "Determine which specific messages an attacker read, from where, and whether the record is complete.",
      "overview": {
        "context": "After a confirmed account compromise the notification and legal questions turn on exactly which messages were exposed. MailItemsAccessed is the only telemetry that answers that at message granularity, via the InternetMessageId of each item bound. It is also the artifact most often assumed present when it is not.",
        "actorBehavior": [
          "Authenticates with a stolen token, refresh token or password and reads mail over REST, EWS, MAPI, IMAP or ActiveSync.",
          "Synchronises the mailbox to a desktop Outlook client, producing Sync rather than Bind records and removing per-message detail.",
          "Uses an OAuth application identity so the access does not appear in interactive sign-in telemetry.",
          "Generates enough access volume to trip audit throttling, degrading the record of their own activity as a side effect."
        ],
        "triageQuestions": [
          "Which InternetMessageIds were bound, and do any correspond to messages containing regulated data?",
          "Was access Owner, Admin or Delegate context?",
          "Was the mailbox throttled at any point in the window, making the item list incomplete?",
          "Did access arrive through an application identity rather than an interactive session?"
        ],
        "mitre": [
          {
            "id": "T1114.002",
            "role": "primary",
            "note": "Remote collection of mail content from the cloud mailbox."
          },
          {
            "id": "T1078.004",
            "role": "supporting",
            "note": "Access is via a valid cloud identity, not an exploit."
          },
          {
            "id": "T1550.001",
            "role": "supporting",
            "note": "Applies where access is token- or application-mediated."
          }
        ],
        "ual": {
          "workloads": [
            "Exchange"
          ],
          "recordTypeIds": [
            50,
            2
          ],
          "operations": [
            {
              "name": "MailItemsAccessed",
              "recordTypeId": 50,
              "note": "Two operation types. Bind records individual message access and carries FolderItems with InternetMessageId. Sync records a bulk client download and carries no per-item detail."
            },
            {
              "name": "FolderBind",
              "recordTypeId": 2,
              "note": "Folder was opened. Useful for delegate-context access even where MailItemsAccessed is absent."
            }
          ]
        },
        "access": {
          "auditTier": "standard",
          "licenseNotes": [
            {
              "text": "MailItemsAccessed is Audit (Standard) functionality. Microsoft Learn states it is enabled by default for users assigned an Office 365 E3/E5 or Microsoft 365 E3/E5 licence. Much third-party material still describes it as E5-only; that guidance is stale.",
              "verified": true,
              "lastVerified": "2026-09-06",
              "severity": "critical",
              "source": "https://learn.microsoft.com/en-us/purview/audit-log-investigate-accounts"
            },
            {
              "text": "E1 mailboxes are not covered. Confirm the specific user licence before assuming the artifact exists.",
              "verified": true,
              "lastVerified": "2026-09-06",
              "severity": "caution"
            },
            {
              "text": "Mailbox auditing must not have been narrowed by a custom audit set. Where AuditOwner, AuditDelegate or AuditAdmin have been customised, verify MailItemsAccessed is still in the configured action list.",
              "verified": true,
              "lastVerified": "2026-09-06",
              "severity": "caution"
            }
          ],
          "rbac": [
            {
              "text": "Search-UnifiedAuditLog requires the View-Only Audit Logs or Audit Logs role in Exchange Online, held by default through the Compliance Management and Organization Management role groups.",
              "verified": true,
              "lastVerified": "2026-09-06",
              "source": "https://learn.microsoft.com/en-us/powershell/module/exchangepowershell/search-unifiedauditlog"
            },
            {
              "text": "The AuditLogQuery Graph API requires the AuditLogsQuery.Read.All permission, granted to the calling application or delegated user.",
              "verified": true,
              "lastVerified": "2026-09-06",
              "source": "https://learn.microsoft.com/en-us/graph/api/resources/security-auditlogquery"
            }
          ]
        }
      },
      "acquisition": {
        "methods": [
          {
            "id": "exo-mia",
            "title": "Exchange Online PowerShell with backoff and completeness checking",
            "transport": "exo-powershell",
            "status": {
              "text": "Since late January 2025 the HighCompleteness parameter is permanently true for all Search-UnifiedAuditLog queries. Searches are materially slower than the pre-2025 behaviour and throttle readily. Default to wider slices with exponential backoff rather than narrow slices with a fixed sleep.",
              "verified": true,
              "lastVerified": "2026-09-06",
              "severity": "critical",
              "source": "https://learn.microsoft.com/en-us/powershell/module/exchangepowershell/search-unifiedauditlog"
            },
            "params": [
              {
                "name": "StartDate",
                "type": "date",
                "label": "Window start (UTC)",
                "default": "2026-08-01T00:00:00Z"
              },
              {
                "name": "EndDate",
                "type": "date",
                "label": "Window end (UTC)",
                "default": "2026-09-01T00:00:00Z"
              },
              {
                "name": "TargetUpn",
                "type": "string",
                "label": "Target mailbox UPN",
                "default": "jsmith@contoso.com"
              },
              {
                "name": "IntervalHours",
                "type": "number",
                "label": "Slice size (hours)",
                "default": 6,
                "help": "Widen for low-volume mailboxes. Narrow only if a slice reports the 50,000-record ceiling."
              },
              {
                "name": "OutputPath",
                "type": "path",
                "label": "Output directory",
                "default": "C:\\\\IR\\\\UAL"
              }
            ],